paper,citationKey,robot,Main
"Stefanini, C., Orofino, S., Manfredi, L., Mintchev, S., Marrazza, S., Assaf, T., Capantini, L., Sinibaldi, E., Grillner, S., Wallen, P., & Dario, P. (2012). A compliant bioinspired swimming robot with neuro-inspired control and autonomous behavior. Proceedings - IEEE International Conference on Robotics and Automation, 5094–5098. https://doi.org/10.1109/ICRA.2012.6224948",Stefanini_etal_2012_b,,TRUE
"Grillner, S., ""Biological pattern generation: the cellular and computational logic of networks in motion"", Neuron, 52: 751-766, 2006.",Grillner_2006_b,,FALSE
"Kiehn, O., ""Locomotor circuits in the mammalian spinal cord"", Annual Review of Neuroscience, vol. 29, n. 1, 279-306, 2006.",Kiehn_2006,,FALSE
"Feldman, J.L. and Del Negro, C.A., ""Looking for inspiration: new perspectives on respiratory rhythm"", Nat. Rev. Neurosci., vol. 7, n. 3, 232-241, 2006.",Feldman_2006,,FALSE
"Isa, T., ""Intrinsic processing in the mammalian superior colliculus"", Curr. Opin. Neurobiol. 12:668–677, 2002.",Isa_2002,,FALSE
"Deliagina, T.G., Sirota, M.G., Zelenin, P.V., Orlovsky, G.N. and Beloozerovam “Interlimb postural coordination in the standing cat”, J Physiol, 573, 211–224, 2006.",Deliagina_etal_2006,,FALSE
"Kozlov, A., Huss, M., Lansner, A., Hellgren Kotaleski, J. and Grillner, S., ""Simple cellular and network control principles govern complex patterns of motor behavior"", PNAS, vol. 106 no. 47, 20027-20032, 2009",Kozlov_etal_2009,,FALSE
"Ijspeert A.J., Crespi A., Ryczko D., Cabelguen J.M., “From Swimming to Walking with a Salamander Robot Driven by a Spinal Cord Model” Science, Vol. 315 no. 5817, pp. 1416-1420, 2007",Ijspeert_etal_2007,,FALSE
"Kotay K.D. and Rus D.L., ""The inchworm robot: a multi-functional system"" Auton. Robots 8:53–69, 2000.",Kotay_2000,,FALSE
"Menciassi A., Gorini S., Pernorio G., and Dario P. ""A SMA artificial earthworm"". In Proceeding of IEEE International Conference on Robotics and Automation, New Orleans, 4:3282–3287, 2004.",Menciassi_etal_2004,,FALSE
"Hopkins, J.K. et al “A survey of snake-inspired robot designs” Bioinspir. Biomim. 4, 2009.",Hopkins_2009,,FALSE
"Trimmer B.A., Takesian A.E., Sweet B.M., Rogers C.B., Hake D.C. and Rogers D.J. “Caterpillar locomotion: a new model for soft-bodied climbing and burrowing robots”. In Proc. 7th Int. Symp. on Technology and the Mine Problem, Monterey, CA: Mine Warfare Association 2006",Trimmer_etal_2006,,FALSE
"Deng, X., and Avadhanula, S. ""Biomimetic micro underwater vehicle with oscillating fin propulsion: System design and force measurement"". In Proceedings of the 2005 IEEE international conference on robotics and automation, 3312-3317, 2005.",Deng_2005,,FALSE
"Gu, S., Ye, X., Guo, S., Hao, Y., ""A Novel Fish-Like Microrobot with Joint Style Actuated by ICPF and SMA"", Proceedings of 2nd Joint Student Workshop on Mechatronics, 31-34, Harbin and Changchun, China, Sep. 16-22, 2008.",Gu_etal_2008,,FALSE
"Stefanini, C., Orlandi, G., Menciassi, A., Ravier, Y., La Spina, G., Grillner, S. and Dario, P., ""A Mechanism for Biomimetic Actuation in Lamprey-like Robots"", Proceedings of the First IEEE/RAS-EMBS Robotics and Biomechatronics, 2006. BioRob 2006. February 20-22, 579-584, 2006.",Stefanini_etal_2006,,FALSE
"Grillner, S., Kozlov, A., Dario, P., Stefanini, C., Menciassi, A., Lansner, A., Hellgren Kotaleski, J., “Modeling a vertebrate motor system: pattern generation, steering and control of body orientation”. Prog. Brain Res. 2007;165:221-34.",Griller_etal_2007,,FALSE
"Stefanini, C., Orofino, S., Manfredi, L., Mintchev, S., Marrazza, S., Assaf, T., Capantini, L., Sinibaldi, E., Grillner, S., Wallén, P., & Dario, P. (2012). A novel autonomous, bioinspired swimming robot developed by neuroscientists and bioengineers. Bioinspiration & Biomimetics, 7(2), 25001. http://stacks.iop.org/1748-3190/7/i=2/a=025001",Stefanini_etal_2012,,TRUE
"Struebig, K., Bayat, B., Eckert, P., Looijestijn, A., Lueth, T. C., & Ijspeert, A. J. (2020). Design and development of the efficient anguilliform swimming robot-MAR. Bioinspiration and Biomimetics, 15(3), 035001. https://doi.org/10.1088/1748-3190/ab6be0",Struebig_etal_2020,,TRUE
"Carlton J, Aldwinkle J and Anderson J 2013 Future Ship Powering Options: Exploring Alternative Methods of Ship Propulsion (London: Royal Academy of Engineering)",Carlton_etal_2013,,FALSE
"van Ginneken V, Antonissen E, Müller U K, Booms R, Eding E, Verreth J and van den Thillart G 2005 Eel migration to the sargasso: remarkably high swimming efficiency and low energy costs J. Exp. Biol. 208 1329–35",van_Ginneken_etal_2005,,FALSE
"Crespi A, Badertscher A, Guignard A and Ijspeert A J 2005 AmphiBot I: an amphibious snake-like robot Robot. Auton. Syst. 50 163–75",Crespi_etal_2005,,FALSE
Crespi A and Ijspeert A J 2006 AmphiBot II: an amphibious snake robot that crawls and swims using a central pattern generator Int. Conf. Climbing and Walking Robots (CLAWAR 2006) pp 19–27,Crespi_2006,,FALSE
"Bayat B, Crespi A and Ijspeert A 2016 Envirobot: a bioinspired environmental monitoring platform IEEE/OES Conf. Autonomous Underwater Vehicles (Tokyo, Japan) ",Bayat_2016,,FALSE
Williams T M 1989 Swimming by sea otters: adaptations for low energetic cost locomotion J. Comparative Physiol. A 164 815–24,Williams_1989,,FALSE
Nicolas G and Bideau B 2009 A kinematic and dynamic comparison of surface and underwater displacement in high level monofin swimming Hum. Mov. Sci. 28 480–93,Nicolas_2009,,FALSE
"Zarrouk D, Mann M, Degani N, Yehuda T, Jarbi N and Hess A 2016 Single actuator wave-like robot (SAW): design, modeling, and experiments Bioinspiration Biomimetics 11 046004",Zarrouk_2016,,FALSE
"Maurya P, Aguiar A P and Pascoal A 2009 Marine vehicle path following using inner-outer loop control IFAC Proc. Volumes vol 42 pp 38–43",Maurya_etal_2009,,FALSE
"Paschal T 2017 Undulatory swimming versus propeller based Technical Report BioRob, EPFL ",Paschal_2017,,FALSE
"Su, Z., Yu, J., Tan, M., & Zhang, J. (2014). Implementing flexible and fast turning maneuvers of a multijoint robotic fish. IEEE/ASME Transactions on Mechatronics, 19(1), 329–338. https://doi.org/10.1109/TMECH.2012.2235853",Su_etal_2014,,TRUE
"P. Domenici, ""Webb scales fast-start maneuvers,"" J. Exp. Biol., vol. 214, no. 6, pp. 875–877, 2011.",Domenici_2011,,FALSE
"P. McClenahan, M. Troup, and E. K. Scott, ""Fin-tail coordination during escape and predatory behavior in larval zebrafish,"" PLoS ONE, vol. 7, no. 2, p. e32295, 2012.",Mcclenahan_etal_2012,,FALSE
"K. Abdelnour, A. Stinchcombe, M. Porfiri, J. Zhang, and S. Childress, ""Wireless powering of ionic polymer metal composites towards hovering micro-swimmers,"" IEEE/ASME Trans. Mechatronics, vol. 17, no. 5, pp. 924–935, Oct. 2012.",Abdelnour_etal_2012,,FALSE
"Yu S, Ma S, Li B and Wang Y 2009 An amphibious snake-like robot: design and motion experiments on ground and in water Int. Conf. on Information and Automation (IEEE) pp 500–5",Yu_etal_2009_b,,FALSE
"K. T. Sillar and R. M. Robertson, ""Thermal activation of escape swimming in post-hatching Xenopus laevis frog larvae,"" J. Exp. Biol., vol. 212, no. 15, pp. 2356–2364, 2009.",Sillar_2009,,FALSE
"Z. Su, J. Yu, M. Tan, and J. Zhang, ""Bio-inspired design of body wave and morphology in fish swimming based on linear density,"" presented at the IEEE Int. Conf. Robotics Biomimetics, Guilin, China, Dec. 2009, pp.",Su_etal_2009,,FALSE
"J. L. Maresh, F. E. Fish, D. P. Nowacek, S. M. Nowacek, and R. S. Wells, ""High performance turning capabilities during foraging by bottlenose dolphins,"" Mar. Mammal Sci., vol. 20, no. 3, pp. 498–509, 2004.",Maresh_etal_2004,,FALSE
"Tan, X., Kim, D., Usher, N., Laboy, D., & Jackson, J. (2006). An Autonomous Robotic Fish for Mobile Sensing An Autonomous Robotic Fish for Mobile Sensing. IEEE/RSJ International Conference on Intelligent Robots and Systems, 5424–5429.",Tan_etal_2006,,TRUE
"N. E. Leonard and E. Fiorelli, “Virtual leaders, artificial potentials and coordinated control of groups,” in Proceedings of the 40th IEEE Conference on Decision and Control, Orlando, FL, 2001, pp. 2968– 2973.",Leonard_2001_b,,FALSE
"B. R. Martin, “Energy harvesting applications of ionic polymers,” Master’s thesis, Virginia Polytechnic Institute and State University, 2005",Martin_2005,,
"N. E. Leonard and J. G. Graver, ""Model-based feedback control of autonomous underwater gliders,"" IEEE Journal of Oceanic Engineering, vol. 26, no. 4, pp. 633–645, 2001.",Leonard_2001,,FALSE
"T. Fukuda, H. Hosokai, and I. Kikuchi, ""Distributed type of actuators by shape memory alloy and its application to underwater mobile robotic mechanism,"" in Proceedings of the IEEE Conference on Robotics and Automation, 1990, pp. 1316–1321.",Fukuda_etal_1990,,FALSE
"S. Guo, T. Fukuda, and K. Asaka, ""A new type of fish-like underwater microrobot,"" IEEE/ASME Transactions on Mechatronics, vol. 8, no. 1, pp. 136–141, 2003.",Guo_etal_2003,,FALSE
"Y. Bar-Cohen, ""Electric flex,"" IEEE Spectrum, vol. 41, no. 6, pp. 29–33, 2004.",Bar-Cohen_2004,,FALSE
"H. A. Sodano, D. J. Inman, and G. Park, ""Generation and storage of electricity from power harvesting devices,"" Journal of Intelligent Material Systems and Structures, vol. 16, pp. 67–75, 2005.",Sodano_etal_2005,,FALSE
"Z. Chen, Y. Shen, N. Xi, and X. Tan, ""Integration and modeling of IPMC and PVDF for simultaneous actuation and sensing,"" Smart Materials and Structures, 2006, under review.",Chen_etal_2006,,FALSE
"A. Jadbabaie, J. Lin, and A. S. Morse, ""Coordination of groups of mobile autonomous agents using nearest neighbor rules,"" IEEE Transactions on Automatic Control, vol. 48, no. 6, pp. 988–1001, 2003.",Jadbabaie_etal_2003,,FALSE
"R. Olfati-Saber and R. M. Murray, ""Consensus problems in networks of agents with switching topology and time-delays,"" IEEE Transactions on Automatic Control, vol. 49, no. 9, pp. 1520–1533, 2004.",Olfati-Saber_2004,,FALSE
"L. Moreau, ""Stability of multiagent systems with time-dependent communication links,"" IEEE Transactions on Automatic Control, vol. 50, no. 2, pp. 169–182, 2005.",Moreau_2005,,FALSE
"W. Xi, X. Tan, and J. S. Baras, ""Gibbs sampler-based coordination of autonomous swarms,"" Automatica, vol. 42, no. 7, pp. 1107–1119, 2006.",Xi_etal_2006,,FALSE
"Thandiackal, R., White, C. H., Bart-Smith, H., & Lauder, G. V. (2021). Tuna robotics: Hydrodynamics of rapid linear accelerations. Proceedings of the Royal Society B: Biological Sciences, 288(1945). https://doi.org/10.1098/rspb.2020.2726",Thandiackal_etal_2021,,TRUE
"Akanyeti O, Putney J, Yanagitsuru YR, Lauder GV, Stewart WJ, Liao JC. 2017 Accelerating fishes increase propulsive efficiency by modulating vortex ring geometry. Proc. Natl Acad. Sci. USA",Akanyeti_etal_2017,,FALSE
"Du Clos KT, Dabiri JO, Costello JH, Colin SP, Morgan JR, Fogerson SM, Gemmell BJ. 2019 Thrust generation during steady swimming and acceleration from rest in anguilliform swimmers. J. Exp. Biol. 222. (doi:10.1242/jeb.212464",Du_2019_b,,FALSE
"Flammang BE, Lauder GV. 2009 Caudal fin shape modulation and control during acceleration, braking and backing maneuvers in bluegill sunfish, Lepomis macrochirus. J. Exp. Biol. 212, 277–286. (doi:10.",Flammang_2009,,FALSE
"Schwalbe MAB, Boden AL, Wise TN, Tytell ED. 2019 Red muscle activity in bluegill sunfish Lepomis macrochirus during forward accelerations. Sci. Rep. 9, 8088. (doi:10.1038/s41598-019-44409-7)",Schwalbe_2019,,FALSE
"Dabiri JO, Bose S, Gemmell BJ, Colin SP, Costello JH. 2014 An algorithm to estimate unsteady and quasi- steady pressure fields from velocity field measurements. J. Exp. Biol. 217, 331–336. (doi:10. 1242/jeb.092767)",Dabiri_etal_2014,,FALSE
"Currier T, Modarres-Sadeghi Y. 2019 An experimental model with passively variable stiffness to investigate the effect of body stiffness on the fish fast-start maneuver. Exp. Fluids 60, 147. (doi:10.",Currier_2019,,FALSE
"Mathis A, Mamidanna P, Cury KM, Abe T, Murthy VN, Mathis MW, Bethge M. 2018 DeepLabCut: markerless pose estimation of user-defined body parts with deep learning. Nat. Neurosci. 21, 1281–1289. (doi:10.1038/s41593-018-0209-y)",Mathis_etal_2018,,FALSE
"Lucas KN, Lauder GV, Tytell ED. 2020 Airfoil-like mechanics generate thrust on the anterior body of swimming fishes. Proc. Natl Acad. Sci. USA 117, 10 585–10 592. (doi:10.1073/pnas.1919055117)",Lucas_etal_2020,,FALSE
"Gemmell BJ, Colin SP, Costello JH, Dabiri JO. 2015 Suction-based propulsion as a basis for efficient animal swimming. Nat. Commun. 6,1–8. (doi:10. 1038/ncomms9790)",Gemmell_etal_2015,,FALSE
"Toming, G., Salumae, T., & Ristolainen, A. (2012). Fluid dynamics experiments with a passive robot in regular turbulence. IEEE International Conference on Robotics and Biomimetics, April 2019. https://doi.org/10.1109/ROBIO.2012.6491021",Toming_etal_2012,,TRUE
"T. Salumäe, ""Design of a compliant underwater propulsion mechanism by investigating and mimicking the body of a rainbow trout (Oncorhynchus mykiss)"", MS Thesis, Tallinn University of Technology, 2010.",Salumaee_2010,,FALSE
"R. Michel, D. Arnal, ""Laminar-turbulent transition"", In IUTAM Symposium, Tolouse, France, 1989.",Michel_1989,,FALSE
"Tytell, E. D. (2004). Kinematics and hydrodynamics of linear acceleration in eels , Anguilla rostrata. The Royal Society, December, 2535–2540. https://doi.org/10.1098/rspb.2004.2901",Tytell_etal_2004,,TRUE
"Batchelor, G. K. 1973 An introduction to fluid dynamics. Cambridge University Press.",Batchelor_1973,,FALSE
"Blake, R. W. 1979 The energetics of hovering in the mandarin fish (Synchropus picturatus). J. Exp. Biol. 82, 25–33.",Blake_1979_b,,FALSE
"Daniel, T. L. 1984 Unsteady aspects of aquatic locomotion. Am. Zool. 24, 121–134.",Daniel_1984,,FALSE
"Facchinetti, M. L., de Langre, E. & Biolley, F. 2004 Coupling of structure and wake oscillators in vortex-induced vibrations. J. Fluids Struct. 19, 123–140. (doi:10.1016/j.fluidstructs.2003.12.004)",Facchinetti_etal_2004,,FALSE
"Fincham, A. M. & Spedding, G. R. 1997 Low cost, high resolution DPIV for measurement of turbulent fluid flow. Exp. Fluids 23, 449–462.",Fincham_1997,,FALSE
"Hart, D. P. 1999 Super-resolution PIV by recursive local-correlation. J. Visual. 10, 1–10.",Hart_1999,,FALSE
"Muller, U. K., van den Heuvel, B.-L. E., Stamhuis, E. J. & Videler, J. J. 1997 Fish foot prints: morphology and ener- getics of the wake behind a continuously swimming mullet (Chelon labrosus Risso). J. Exp. Biol. 200, 2893–2906.",Muller_etal_1997,,FALSE
"Rayner, J. M. V. & Thomas, A. L. R. 1991 On the vortex wake of an animal flying in a confined volume. Phil. Trans. R. Soc. Lond. B 334, 107–117.",Rayner_1991,,FALSE
"Schlichting, H. 1979 Boundary-layer theory. New York: McGraw-Hill.",Schlichting_1979,,FALSE
"Tytell, E. D. & Ellington, C. P. 2003 How to perform mea- surements in a hovering animal’s wake: physical modelling of the vortex wake of the hawkmoth, Manduca sexta. Phil. Trans. R. Soc. Lond. B 358, 1559–1566. (doi:10.1098/ rstb.2003.1355)",Tytell_2003,,FALSE
"van den Thillart, G., van Ginneken, V., Korner, F., Heijmans, R., van der Linden, R. & Gluvers, A. 2004 Endurance swimming of European eel. J. Fish Biol. 65, 312–318.",van_den_Thillart_etal_2004,,FALSE
"Walker, J. A. 1998 Estimating velocities and accelerations of animal locomotion: a simulation experiment comparing numerical differentiation algorithms. J. Exp. Biol. 201, 981–995.",Walker_1998,,FALSE
"Webb, P. W. 1991 Composition and mechanics of routine swimming of rainbow trout, Oncorhynchus mykiss. Can. J.",Webb_1991,,FALSE
"Valdivia y Alvarado, P., & Youcef-Toumi, K. (2006). Design of machines with compliant bodies for biomimetic locomotion in liquid environments. Journal of Dynamic Systems, Measurement and Control, Transactions of the ASME, 128(1), 3–13. https://doi.org/10.1115/1.2168476",Valdivia_y_Alvaardo_2006,,TRUE
"Yuh, J., and West, M., 2001, ""Underwater Robotics,"" Adv. Rob., 15(5), pp.",Yuh_2001,,FALSE
"Dickinson, M. H., Farley, C. T., Full, R. J., Koehl, M. A. R., Kram, R., and Lehman, S., 2000, ""How Animals Move: An Integrative View,"" Science, 288(5463), pp. 100–106.",Dickinson_2000,,FALSE
"Timoshenko, S., Young, D. H., and Weaver, W. Jr., 1974, Vibration Problems in Engineering, Wiley, New York.",Timoshenko_etal_1974,,FALSE
" Cham, J. G., Pruitt, B. L., Cutkosky, M. R., Binnard, M., Weiss, L. E., and Neplotnik, G., ""Layered Manufacturing With Embedded Components: Process Planning Issues,"" Proc. of ASME Design Engineering Technical Conference, Las Vegas, 1999.",Cham_etal_1999,,FALSE
"Valdivia y Alvarado, P., and Youcef-Toumi, K., 2005, ""Performance of Machines with Flexible Bodies Designed for Biomimetic Locomotion in Liquid",Valdivia_2005,,FALSE
"VIDELER, J. J., & HESS, F. (1984). Fast Continuous Swimming of Two Pelagic Predators, Saithe ( Pollachius Virens ) and Mackerel ( Scomber Scombrus ): a Kinematic Analysis. Journal of Experimental Biology, 109(1), 209–228. https://doi.org/10.1242/jeb.109.1.209",VidelerHess_1984,,TRUE
"AHLBERG, J. H., NILSON, E. N. & WALSH, J. L. (1967). The Theory of Splines and their Applications. New",Ahlberg_etal_1967,,FALSE
"BLAXTER, J. H. S. & DICKSON, W. (1959). Observations on swimming speeds of fish. J. Cons. perm. int. Explor. Mer 24, 472-479.",Blaxter_1959,,FALSE
"GREER WALKER, M. & PULL, G. (1973). Skeletal muscle function and sustained swimming speeds in the coal fish (Gadus virens L.). Comp. Biochem. Physiol. 44A, 495-501.",Walker_etal_1973,,FALSE
"HESS, F. & VIDELER, J. J. (1984). Fast continuous swimming of saithe (Pollachius virens): a dynamic analysis of bending moments and muscle power. J. exp. Biol. 109, 229-251.",Hess_1984,,FALSE
"HIMMELBLAU, D. M. (1972). Applied non-linear Programming. New York: McGraw.",Himmelblau_1972,,FALSE
"VIDELER, J. J. (1981). Swimming movements, body structure and propulsion in Cod (Gadus morhua). In Vertebrate Locomotion, (ed. M. H. Day). Symp. Zool. Soc. Land. 48, 1-27. London: Academic Press.",Videler_1981,,FALSE
"VIDELER, J. J. & WEIHS, D. (1982). Energetic advantages of burst-and-coast swimming of fish at high speedy J. exp. Biol. 97, 169-178.",Videler_1982,,FALSE
"WARDLE, C. S. (1979). Effects of temperature on the maximum swimming speed of fishes. In Environmental Physiology of Fishes, (ed. M. A. Ali). NATO advanced Study Inst. Ser. A. 35, 519-531.",Wardle_1979,,FALSE
"WARDLE, C. S. & VIDELER, J. J. (1980a). Fish swimming. In Aspects ofAnimal Movement, (eds H. T. Elder & E. R. Trueman). Soc. exp. Biol. Symp. 5, 125-150. Cambridge: Cambridge University Press.",Wardle_1980_b,,FALSE
"Videler, J. J., & Wardle, C. S. (1991). Fish swimming stride by stride: speed limits and endurance. Reviews in Fish Biology and Fisheries, 1(1), 23–40. https://doi.org/10.1007/BF00042660",VidelerWardle_1991,,TRUE
"Aitringham, J.D. and Johnson, I.A. (1990) Scaling effects on muscle function: power output of isolated fish muscle fibres performing oscillatory work. J. exp. Biol. 151, 453-67.",Aitringham_1990,,FALSE
"Archer, S.D., Altringham, J.D. and Johnston, I.A. (1990) Scaling effects on the neuromuscular system, twitch kinetics and morphometrics of the cod, Gadus morhua. Mar. Behav, Physiol. 17, 137-46.",Archer_etal_1990,,FALSE
"Bainbridge, R. (1960) Speed and stamina in three fish. J. exp. Biol. 37, 129-53.",Bainbridge_1960,,FALSE
"Beamish, EW.H. (1966) Swimming endurance of some Northwest Atlantic fishes. J. Fish. Res. Bd Can. 23, 341-7.",Beamish_1966,,FALSE
,,,FALSE
"Beamish, F.W.H. (1984) Swimming performance of three Southwest Pacific Fishes. Mar. Biol. 79, 311-13.",Beamish_1984,,FALSE
"Blaxter, J.H.S. (1969) Swimming speeds of fish. FAO Fish. Rep. 62(2), 69-100.",Blaxter_1969,,FALSE
"Brett, J.R. (1967) Swimming performance of sockeye salmon (Oncorhynchus nerka) in relation to fatigue, time and temperature. J. Fish. Res. Bd Can. 24, 1731-41.",Brett_1967,,FALSE
"Brett, J.R. (1982) The swimming speed of adult pink salmon (Oncorhynchus gorbuscha) at 20 degree C and a comparison with sockeye salmon, O. nerka. Can tech. Rep. Fish. Aquat. Sci. No. 1143.40 pp.",Brett_1982,,FALSE
"Dorn, P., Johnson, L. and Darby, C. (1979) The swimming performance of nine species of common California inshore fishes. Trans. Am. Fish. Soc. 108, 366-72.",Dorn_etal_1979,,FALSE
"Edman, K.A.P., Mulieri, L.A. and Scubon-Mulieri, B. (1976) Non-hyperbolic force-velocity relationship in single muscle fibres. Acta physiol, scantL 98, 143-56.",Edman_etal_1976,,FALSE
"He, P. (1986) Swimming performance of three species of marine fish and some aspects of swimming in fishing gears. PhD thesis Aberdeen University. 232 pp.",He_1986_b,,FALSE
"Langfeld, K.S., Altringham, J.D. and Johnston, I.A. (1989) Temperature and the force-velocity relationship of live muscle fibres from the teleost Myoxocephalus scorpius. J. exp. Biol. 144, 437-48.",Langfeld_etal_1989,,FALSE
"Lannergren, J., Lindblom, P. and Johansson, B. (1982) Contractile properties of two varieties of twitch muscle fibres in Xenopus laevis. Acta physiol, scand. 114, 523-35.",Lannergren_etal_1982,,FALSE
"McCleave, J.D. (1980) Swimming performance of European eel (Anguilla anguilla (L.)) elvers. J. Fish. Biol. 16, 445-52.",McCleave_1980,,FALSE
"McVean, A.R. and Montgomery, J.C. (1987) Temperature compensation in myotomal muscle: Antarctic versus temperate fish. Env. Biol. Fishes. 19(1), 27-33.",McVean_1987,,FALSE
"Schmidt-Nielsen, K. (1990) Animal Physiology: Adaptation and Environment, 4th edn. Cambridge: Cambridge U.P. 602 pp.",Schmidt-Nielsen_1990,,FALSE
"Tsukamoto, K., Kajihara, T. and Nishiwaki, M. (1975) Swimming ability of fish. Bull. Jap. Soc.",Tsukamoto_etal_1975,,FALSE
"Wardle, C.S. (1977) Effects of size on the swimming speeds of fish. In Pedley, T.J., ed. Scale Effects in Animal Locomotion. London: Academic Press, pp. 299-313.",Wardle_1977,,FALSE
"Wardle, C.S. (1980) Effects of temperature on the maximum swimming speed of fish. In Ali, M.A., ed. The Environmental Physiology of Fishes. New York: Plenum, pp. 519-31.",Wardle_1980_c,,FALSE
"Wardle, C.S. and Kanwisher, J.W. (1974) The significance of heart rate in free swimming cod, Gadus morhua: some observations with ultra-sonic tags. Mar. Behav. PhysioL 2, 311-24.",Wardle_1974,,FALSE
"Webb, P.W. (1971) The swimming energetics of trout: I. Thrust and power output at cruising speeds. J. exp. Biol. 55, 489-520.",Webb_1971_b,,FALSE
"Webb, P.W. and Keyes, R.S. (1982) Swimming kinematics of sharks. Fishery Bull. Fish Wildl. Serv. U.S. 80, 803-12.",Webb_1982_c,,FALSE
"Vorus, W. S., & Taravella, B. M. (2011). Anguilliform fish propulsion of highest hydrodynamic efficiency. Journal of Marine Science and Application, 10(2), 163–174. https://doi.org/10.1007/s11804-011-1056-3",VorusTaravella_2011,,TRUE
Ayers J (1992). Desktop motion video for scientific image analysis.,Ayers_1992,,FALSE
"Lighthill MJ (1952). On the squirming motion of nearly spherical deformable bodies through liquids at very small Reynolds number. Commun. Pure Appl. Maths, 5, 109-118.",Lighthill_1952,,FALSE
"Miloh T, Galper A (1993). Self-propulsion of general deformable shapes in a perfect fluid. Proc. Royal Soc. Lond, A 442, 273-299.",Miloh_1993,,FALSE
"Saffman PG (1967). The Self-propulsion of a deformable body in a perfect fluid. J. Fluid Mech, 28, 285-289.",Saffman_1967,,FALSE
"Vorus WS (1995). The concept of a traveling-wave propulsor for high efficiency and low wake signature. 24th ATTC, College Station, TX.",Vorus_1995,,FALSE
"Vorus WS (1996). A reduced-wake marine propulsor concept, annual report to ONR, Grant No. N00014-96-0124, November.",Vorus_1996,,FALSE
"Vorus WS (2005). Swimming of the semi-infinite strip revisited, J.",Vorus_2005,,FALSE
"Wang, M., Yu, J. Z., Tan, M., & Zhang, J. W. (2012). Multimodal swimming control of a robotic fish with pectoral fins using a CPG network. Chinese Science Bulletin, 57(10), 1209–1216. https://doi.org/10.1007/s11434-012-5005-6",Wang_etal_2012,,TRUE
"Hu T J, Shen L C, Low K H. Bionic asymmetry: From amiiform fish to undulating robotic fins. Chin Sci Bull, 2009, 54: 562–568",Hu_etal_2009_c,,
"Ha N S, Goo N S, Yoon H J. Development of a propulsion system for a biomimetic thruster. Chin Sci Bull, 2011, 56: 432–438",Ha_etal_2011,,
"Zhou C L, Low K H. Kinematic modeling framework for biomimetic undulatory fin motion based on coupled nonlinear oscillators. In: Proc IEEE/RSJ Int Conf Intell Robot Syst, Taipei, Taiwan, Oct 2010. 34–939",Zhou_2010_b,,
"Cohen A H, Holmes P J, Rand R H. The nature of the coupling be- tween segmental oscillators of the lamprey spinal generator for lo- comotion: A mathematical model. J Math Bio, 1982, 13: 345–369 18",Cohen_etal_1982,,
"Zhang D B, Hu D W, Shen L C, et al. Design of an artificial bionic neural network to control fish-robot’s locomotion. Neurocomputing, 2008, 71: 648–654",Zhang_etal_2008_b,,
"Degallier S, Ijspeert A J. Modeling discrete and rhythmic movements through motor primitives: A review. Biol Cybern, 2010, 103: 319– 338",Degallier_2010,,
"Yu J Z, Wang L, Zhao W, et al. Optimal design and motion control of biomimetic robotic fish. Sci China Ser F - Inf Sci, 2008, 51: 535–549",Yu_etal_2008_b,,
"Zhang D G, Zhu K Y. Computer simulation study on central pattern generator: From biology to engineering. Int J Neural Syst, 2006, 16: 405–422",Zhang_2006,,
"Wang M, Yu J Z, Tan M. Parameter design for a Central Pattern Generator based locomotion controller. In: Proc 1st Int Conf Intell Robot Appl, Part I, LNAI 5314, Wuhan, China, Oct 2008. 352–361",Wang_etal_2008_c,,
"Yu J Z, Fang Y M, Wang L, et al. Visual tracking of multiple robotic fish for cooperative control. In: Proc IEEE Int Conf Robot Biomim, Kunming, China, Dec 2006. 85–90",Yu_etal_2006_b,,
"Webb, P. W. (1971). The swimming energetics of trout. II. Oxygen consumption and swimming efficiency. Journal of Experimental Biology, 55(2), 521–540.",Webb_1971,,TRUE
