paper,citationKey,robot,Main
"Gorissen B, Milana E, Baeyens A, et al. Hardware se- quencing of inflatable nonlinear actuators for autonomous soft robots. Adv Mater 2019;31:e1804598",Gorissen_etal_2019,,
"Gorissen B, Reynaerts D, Konishi S, et al. Elastic inflatable actuators for soft robotic applications. Adv Mater 2017;29: 1604977.Galloway KC, Becker KP, Phillips B, et al. Soft robotic grippers for biological sampling on deep reefs. Soft Robot 2016;3:23–33.",Gorissen_etal_2016,,
"Polygerinos P, Wang Z, Galloway KC, et al. Soft robotic glove for combined assistance and at-home rehabilitation. Robot Autonom Syst 2015;73:135–143",Polygerinos_etal_2015,,
"Rus D, Tolley MT. Design, fabrication and control of soft robots. Nature 2015;521:467",Rus_2015,,
"Mirvakili S, Hunter IW. Artificial muscles: mechanisms, applications, and challenges. Adv Mater 2018;30:1704407.",Mirvakili_2018,,
"Shintake J, Cacucciolo V, Floreano D, et al. Soft robotic grippers. Adv Mater 2018;30:1707035.",Shintake_etal_2018,,
"Boyraz P, Runge G, Raatz A. An overview of novel actu- ators for soft robotics. Actuators 2018;7:48.",Boyraz_etal_2018,,
"Wakimoto S, Suzumori K, Ogura K. Miniature pneumatic curling rubber actuator generating bidirectional motion with one air-supply tube. Adv Robot 2012;25:1311–1330",Wakimoto_etal_2012,,
"Martinez RV, Branch JL, Fish CR, et al. Robotic tentacles with three-dimensional mobility based on flexible elasto- mers. Adv Mater 2013;25:205–212.",Martinez_etal_2013,,
Majidi C. Soft robotics: a perspective—current trends and prospects for the future. Soft Robot 2014;1:5–11.,Majidi_2014,,
"Byrne O, Coulter F, Glynn M, et al. Additive manufacture of composite soft pneumatic actuators. Soft Robot 2018;5: 726–736.",Byrne_etal_2018,,
"Sun Y, Yap HK, Liang X, et al. Stiffness customization and patterning for property modulation of silicone-based soft pneumatic",Sun_etal_2017_b,,
"Fujiwara, S., & Yamaguchi, S. (2017). Development of fishlike robot that imitates carangiform and subcarangiform swimming motions. Journal of Aero Aqua Bio-Mechanisms, 6(1), 1–8.",FujiwaraYamaguchi_2017,,TRUE
"W. S. Hoar and D. J. Randall, Fish Physiology, pp. 9-11, 1978.
",Hoar_1978,,FALSE
"H. Sumoto and S. Yamaguchi, ""A Study on Control Method of Artificial Muscle of Scale Up the Fish Type Robot,"" Journal of the Japan Society of Naval Architects and Ocean Engineers, vol. 23, pp. 157-163, 2010.",Sumoto_2010,,FALSE
"S. Fujiwara and S. Yamaguchi, “A Study on Swimming Performance of Fish Type Robots using Artificial Muscle and Servo Motor,” The Japan Society of Naval Architects and Ocean Engineers, vol. 19, pp. 307-310, 2014",Fujiwara_2014,,FALSE
"S. Fujiwara and S. Yamaguchi, “Development of Fish Type Robots
swimming in a Complex Flow Field,” The Japan Society of Naval Architects and Ocean Engineers, vol. 21, 2015",Fujiwara_2015,,FALSE
"K. Hirata, K. Harumi, T. Takimoto, K. Tamura, M. Makino, Y. Kodama and H. Tomita, “Fundamental Study on Fish Robots,” National Maritime Research Institute, vol. 2, no. 3, pp. 281-307, 2002",Hirata_etal_2002,,FALSE
"Y. Zhao, T. Usami, S. Abe and Y. Takada, “Effect of Phase Difference on Reverse
Karman Vortex Street in Two-joint Small Robotic Fish,” The Japan Society of Mechanical Engineers, no. 15-2, 2A1-E01, 2015.",Zhao_etal_2015,,FALSE
"T. Takeuchi, H. Nakata, T. Wada, H. Ueda, T. Arimoto, S. Watabe and A. Nakamae, A Handbook on Fisheries Science, pp. 208209, 2004.",Takeuchi_etal_2004,,FALSE
"M. Nagai, I. Teruya and T. Nakai, ""Study on an Oscillating Wing Propulsion Ship,"" The Japan Society of Mechanical Engineers, vol., no. 597, 1996.",Nagai_etal_1996,,FALSE
"M. Yokota, K. Yamamoto, Y. Taira, T. Handa and E. Morimoto, “Oxygen Consumption and Swimming Ability of Trachurus japonicas,” Journal of National Fisheries University, vol. 56, no.4, pp. 267- 271, 2008",Yokoto_etal_2008,,FALSE
"K. Onitsuka, J. Akiyama, A. Yamamoto, T. Watanabe and T. Waki, “Study on Burst Speed of Several Fishes Living in Rivers,” Journal of Japan Society of Civil Engineers, vol. 65, no. 4, pp. 296-307, 2009",Onitsuka_etal_2009,,FALSE
"R. T. Jones, “Properties of Low Aspect Ratio Pointed Wings at Speeds Below and Above the Speed of Sound”, NACA, Rep. 835, 1946",Jones_1946,,FALSE
"J. R. Spreiter, “Aerodynamic Properties of Slender Wing-Body Combinations at Subsonic, Transonic, and Supersonic Speeds”, NACA, TN 1662, 1948.",Spreiter_1948,,FALSE
"J. Weber, D. A. Kirby and D. J. Kettle, ”An Extension of Multhopp’s Method of Calculating the Spanwise Loading of Wing- Fuselage Combinations”, British A.R.C, R&M 2872, 1951",Weber_etal_1951,,FALSE
"V. Kopman and M. Porfiri, “Design, Modeling, and Characterization of a Miniature Robotic Fish for Reserch and Education in Biomimetics and Bioinspiration,” IEEE/ASME Transactions on mechatronics, vol. 18, no. 2, April 2013",Kopman_2013,,FALSE
"Gibouin, F., Raufaste, C., Bouret, Y., & Argentina, M. (2018). Study of the thrust-drag balance with a swimming robotic fish. Physics of Fluids, 30(9), 091901. https://doi.org/10.1063/1.5043137",Gibouin_etal_2018,,TRUE
"T. Theodorsen, ""General theory of aerodynamic instability and the mechanism of flutter,"" Report No. 496, National Advisory Committee for Aeronautics, Washington, D.C., 1935.",Theodorsen_1935,,FALSE
"I. E. Garrick, ""Propulsion of a flapping and oscillating airfoil,"" Report No. 567, National Advisory Committee for Aeronautics, Washington, D.C., 1936.",Garrick_1936,,FALSE
"M. Koochesfahani, ""Vortical patterns in the wake of an oscillating airfoil,"" in 25th AIAA Aerospace Sciences Meeting (AIAA, 1987).",Koochesfahani_1987,,FALSE
"L. Schouveiler, F. Hover, and M. Triantafyllou, ""Performance of flapping foil propulsion,"" J. Fluids Struct. 20(7), 949–959 (2005).",Schouveiler_etal_2005,,FALSE
"D. A. Read, F. Hover, and M. Triantafyllou, ""Forces on oscillating foils for propulsion and maneuvering,"" J. Fluids Struct. 17(1), 163–183 (2003).",Read_etal_2003,,FALSE
"K. Moored, P. Dewey, A. Smits, and H. Haj-Hariri, ""Hydrodynamic wake resonance as an underlying principle of efficient unsteady propulsion,"" J. Fluid Mech. 708, 329–348 (2012).",Moored_etal_2012,,FALSE
"P. A. Dewey, B. M. Boschitsch, K. W. Moored, H. A. Stone, and A. J. Smits, ""Scaling laws for the thrust production of flexible pitching panels,"" J. Fluid Mech. 732, 29–46 (2013).",Dewey_etal_2013,,FALSE
"C. Marais, B. Thiria, J. E. Wesfreid, and R. Godoy-Diana, ""Stabilizing effect of flexibility in the wake of a flapping foil,"" J. Fluid Mech. 710, 659–669 (2012).",Marais_etal_2012,,FALSE
"F. Paraz, C. Eloy, and L. Schouveiler, ""Experimental study of the response of a flexible plate to a harmonic forcing in a flow,"" C. R. Mec. 342(9), 532–538 (2014).",Paraz_etal_2014,,FALSE
"F. Paraz, L. Schouveiler, and C. Eloy, ""Thrust generation by a heaving flexible foil: Resonance, nonlinearities, and optimality,"" Phys. Fluids 28(1), 011903 (2016).",Paraz_etal_2016,,FALSE
"C. J. Esposito, J. L. Tangorra, B. E. Flammang, and G. V. Lauder, ""A robotic fish caudal fin: Effects of stiffness and motor program on locomotor performance,"" J. Exp. Biol. 215(1), 56–67 (2012).",Esposito_etal_2012,,FALSE
"S. G. Park, B. Kim, and H. J. Sung, ""Hydrodynamics of a self-propelled flexible fin near the ground,"" Phys. Fluids 29(5), 051902 (2017).",Park_etal_2017,,FALSE
"S. Ramananarivo, R. Godoy-Diana, and B. Thiria, ""Rather than resonance, flapping wing flyers may play on aerodynamics to improve performance,"" Proc. Natl. Acad. Sci. U. S. A. 108(15), 5964–5969 (2011).",Ramananarivo_etal_2011,,FALSE
"M. Gazzola, M. Argentina, and L. Mahadevan, ""Gait and speed selection in slender inertial swimmers,"" Proc. Natl. Acad. Sci. U. S. A. 112(13), 3874–3879 (2015).",Gazzola_etal_2015,,FALSE
"T. Van Buren, D. Floryan, N. Wei, and A. J. Smits, “Flow speed has little impact on propulsive characteristics of oscillating foils,” Phys. Rev. Fluids 3, 013103 (2018)",van_Buren_etal_2018,,
"M. Gazzola, M. Argentina, and L. Mahadevan, ""Scaling macroscopic aquatic locomotion,"" Nat. Phys. 10(10), 758 (2014).",Gazzola_etal_2014,,FALSE
"A. J. Richards and P. Oshkai, “Effect of the stiffness, inertia and oscilla- tion kinematics on the thrust generation and efficiency of an oscillating-foil propulsion system,” J. Fluids Struct. 57, 357–374 (2015).
19S.",Richards_2015,,
"G. K. Taylor, R. L. Nudds, and A. L. Thomas, ""Flying and swimming animals cruise at a Strouhal number tuned for high power efficiency,"" Nature 425(6959), 707–711 (2003).",Taylor_etal_2003,,FALSE
"J. J. Rohr and F. E. Fish, ""Strouhal numbers and optimization of swimming by odontocete cetaceans,"" J. Exp. Biol. 207, 1633–1642 (2004).",Rohr_2004,,FALSE
"M. Saadat, F. Fish, A. Domel, V. Di Santo, G. Lauder, and H. Haj-Hariri, ""On the rules for aquatic locomotion,"" Phys. Rev. Fluids 2(8), 083102 (2017).",Saadat_etal_2017,,FALSE
"M. G. Chopra and T. Kambe, ""Hydromechanics of lunate-tail swimming propulsion. Part 2,"" J. Fluid Mech. 79(1), 49–69 (1977).",Chopra_1977,,FALSE
"G. Karpouzian, G. Spedding, and H. K. Cheng, ""Lunate-tail swimming propulsion. Part 2. Performance analysis,"" J. Fluid Mech. 210, 329–351 (1990).",Karpouzian_etal_1990,,FALSE
"H. Dong, R. Mittal, and F. M. Najjar, ""Wake topology and hydrodynamic performance of low-aspect-ratio flapping foils,"" J. Fluid Mech. 566, 309– 343 (2006).",Dong_etal_2006,,FALSE
"J. H. J. Buchholz and A. J. Smits, ""The wake structure and thrust performance of a rigid low-aspect-ratio pitching panel,"" J. Fluid Mech. 603, 331–365 (2008).",Buchholz_2008,,FALSE
"M. A. Green and A. J. Smits, ""Effects of three-dimensionality on thrust production by a pitching panel,"" J. Fluid Mech. 615, 211–220 (2008).",Green_2008,,FALSE
"D. Floryan, T. Van Buren, C. W. Rowley, and A. J. Smits, ""Scaling the propulsive performance of heaving and pitching foils,"" J. Fluid Mech. 822, 386–397 (2017).",Floryan_etal_2017,,FALSE
"Y. Cha, J. Laut, P. Phamduy, and M. Porfiri, ""Swimming robots have scaling laws, too,"" IEEE/ASME Trans. Mechatronics 21(1), 598–600 (2016).",Cha_etal_2016,,FALSE
"M. Piñeirua, B. Thiria, and R. Godoy-Diana, ""Modelling of an actuated elastic swimmer,"" J. Fluid Mech. 829, 731–750 (2017).",Pineirua_etal_2017,,FALSE
"A. Crespi, K. Karakasiliotis, A. Guignard, and A. J. Ijspeert, ""Salamandra robotica II: An amphibious robot to study salamander-like swimming and walking gaits,"" IEEE Trans. Rob. 29(2), 308–320 (2013).",Crespi_etal_2013,,FALSE
"T. Leclercq and E. de Langre, ""Reconfiguration of elastic blades in oscillatory flow,"" J. Fluid Mech. 838, 606–630 (2018).",Leclercq_2018,,FALSE
"G. K. Batchelor, An Introduction to Fluid Dynamics (Cambridge University Press, 2000).",Batchelor_2000,,FALSE
"F. D. Bianchi, H. de Battista, and R. J. Mantz, Wind Turbine Control Systems: Principles, Modelling and Gain Scheduling Design (Springer-Verlag, London, 2007).",Bianchi_etal_2007,,FALSE
"Harper, D. G., & Blake, R. W. (1990). Fast-start performance of rainbow trout salmo gairdneri and northern pike esox lucius. Journal of Experimental Biology, 150, 321–342. https://doi.org/10.1242/jeb.150.1.321",HarperBlake_1990,,TRUE
"EATON, R. C, NISSANOV, J. AND WLELAND, C. M. (1984). Differential activation of Mauthner and non-Mauthner startle circuits in the zebrafish: implications for functional substitution.",Eaton_etal_1984,,FALSE
"GERO, D. R. (1952). The hydrodynamic aspects offish propulsion. Am. Mus. Novit. 1601,1-32.",Gero_1952,,FALSE
"HARPER, D. G. AND BLAKE, R. W. (1989). A critical analysis of the use of high-speed film to determine maximum accelerations of fish. J. exp. Biol. 142, 465-471.",Harper_1989_b,,FALSE
"HERTEL, H. (1966). Structure, Form and Movement. New York: Reinhold.",Hertel_1966,,FALSE
"LANCZOS, C. (1956). Applied Analysis. Englewood Cliffs: Prentice Hall.",Lanczos_1956,,FALSE
"LAUDER, G. V. (1982). Structure and function in the tail of the pumpkinseed sunfish (Lepomis gibbosus). J. Zool., Lond. 197, 483-495.",Lauder_1982,,FALSE
"MERIAM, J. L. (1975). Dynamics: Second Edition - SI Version. Toronto: John Wiley & Sons, Inc.",Meriam_1975,,FALSE
"RICHARDSON, S. C. (1985). Effects of sampling on blood parameters in the rainbow trout. J. Fish Biol. 26, 725-732.",Richardson_1985,,FALSE
"TILLEY, D. E. AND THUMM, W. (1974). Physics for College Students with Applications to the Life",Tilley_1974,,FALSE
"WEBB, P. W. (1984). Chase response latencies of some teleostean piscivores. Comp. Biochem. Physiol. A 97, 45-48.",Webb_1984_c,,FALSE
"Webb P. W. AND COROLLA, R. T. (1981). Burst swimming performance of northern anchovy, Engraulis mordax, larvae. Fish. Bull. 79, 143-150.",Webb_1981_b,,FALSE
"WEIHS, D. AND WEBB, P. W. (1983). Optimization of locomotion. In Fish Biomechanics (ed.",Weihs_1983,,FALSE
"Hirata, K., Takimoto, T., & Tamura, K. (2000). Study on Turning Performance of a Fish Robot. First International Symposium on Aqua Bio-Mechanisms, 287–292.",Hirata_etal_2000,,TRUE
"Ura, T. and Takagawa, S., Underwater Robots (in Japanese), (1994), Seizan-do.",Ura_1994,,FALSE
"Nagai, M., Hydrodynamics Learning from Dolphin (in Japanese), (1998), Ohmsha.",Nagai_1998,,FALSE
"Iwai, T., et al., Encyclopedia, Fishes (in Japanese), (1998), Gakken.",Iwai_etal_1998,,FALSE
"Isshiki, N. and Morikawa, H., The Study on a Propulsion System by Fin Stroke (in Japanese), Journal of the Marine Engineering Society in Japan, Vol. 14, No. 7 (1979). ",Isshiki_1979,,FALSE
"Howe, S. P., Duff, A. R., & Astley, H. C. (2021). Comparing the turn performance of different motor control schemes in multilink fish-inspired robots. Bioinspiration and Biomimetics, 16(3). https://doi.org/10.1088/1748-3190/abe7cc",Howe_etal_2021,,TRUE
Akanyeti O and Fetherstonhaugh S 2020 A kinematic chain model to quantify undulatory locomotion in animals and robots Integrative and Comparative Biology vol 60 (Oxford: Oxford University Press) p E3,Akanyeti_2020,,FALSE
"Bal C, Ozmen Koca G, Korkmaz D, Akpolat Z H and Ay M 2019 CPG-based autonomous swimming control for multi-tasks of a biomimetic robotic fish Ocean Eng. 189 106334",Bal_2019,,FALSE
Blevins E and Lauder G V 2013 Swimming near the substrate: a simple robotic model of stingray locomotion Bioinspiration Biomimetics 8 016005,Blevins_2013,,FALSE
Borazjani I and Sotiropoulos F 2010 On the role of form and kinematics on the hydrodynamics of self-propelled body/caudal fin swimming J. Exp. Biol. 213 89–107,Borazjani_2010,,FALSE
"Chen D, Wu Z and Yu J 2019 Effect of compliant passive joint on swimming performance for a multi-joint robotic fish 2019 IEEE Int. Conf. on Robotics and Biomimetic",Chen_etal_2019,,FALSE
"Chen X, Yu J, Wu Z, Meng Y and Kong S 2018 Toward a maneu- verable miniature robotic fish equipped with a novel mag- netic actuator system IEEE Trans. Syst. Man Cybern. 50 2327–37",Chen_etal_2018,,FALSE
"Clark A J, Moore J M, Wang J, Tan X and McKinley P K 2012 Evolutionary design and experimental validation ofa flexible caudal fin for robotic fish Artificial Life Conf. Proc. vol 12",Clark_etal_2012,,FALSE
"Coral W, Rossi C, Curet O M and Castro D 2018 Design and assessment of a flexible fish robot actuated by shape memory alloys Bioinspiration Biomimetics 13 056009",Coral_etal_2018,,FALSE
"EllerbyD J, Berlin CG, Cathcart K J, Dornon MK, Feldman A, Gee J K and Moran C J 2018 Assessing the ecological relevance of swimming performance traits: a case studyofbluegill sunfish (Lepomis macrochirus) Aquat. Ecol. 52 311–2",Ellerby_etal_2018,,FALSE
"Epstein M, Colgate J E and MacIver M A 2005 A biologically inspired robotic ribbon fin Proc. of the IEEE/RSJ Int. Conf. on Intelligent Robots and Systems, Workshop on Morphology, Control, and Passive Dynamics
",Epstein_2005,,FALSE
Howe S P and Astley H C 2020 The control of routine fish maneuvers: connecting midline kinematics to turn outcomes J. Exp. Zool. 333 579–94,Howe_2020,,FALSE
Ijspeert A J 2008 Central pattern generators for locomotion control in animals and robots: a review Neural Netw. 21 642–53,Ijspeert_2008,,FALSE
Jian-Xin X and Xue-Lei N 2011 Analytical control design for a biomimetic robotic fish 2011 IEEE Int. Symp. on Industrial Electronics,Jian-Xin_2011,,FALSE
Jindong L and Huosheng H 2005 Mimicry of sharp turning behaviours in a robotic fish Proc. of the 2005 IEEE Int. Conf. on Robotics and Automation,Jindong_2005,,FALSE
" Yu J, Wang S and Tan M 2003 Basic motion control of a freeswimming biomimetic robot fish 42nd IEEE Int. Conf. on Decision and Control (IEEE)",Yu_etal_2003,,FALSE
"Kelasidi E, Pettersen K Y and Gravdahl J T 2014 Stability analysis of underwater snake robot locomotion based on averaging theory 2014 IEEE Int. Conf. on Robotics and Biomimetics ",Kelasidi_etal_2014,,FALSE
"Lauder G, Akanyeti O, Castro-Santos T, DisantoV, Dong H,Goerig E andWainwright D2018 Comparative undulatory kinemat- ics in swimming fishes: quantitative database froma diversity of species Integrative and Comparative Biology 58",Lauder_etal_2018,,FALSE
"Maladen R D, Ding Y, Umbanhowar P B, Kamor A and Goldman D I 2011 Mechanical models of sandfish locomotion reveal
principles of high performance subsurface sand-swimming J. R. Soc. Interface 8 1332–45",Maladen_etal_2011,,FALSE
McClelland J 1839 Indian Cyprinidae 19 (Calcutta: Bishop's College,McClelland_1839,,FALSE
"Ming A, Hashimoto K, Zhao W and Shimojo M 2013 Fundamental analysis for design and control of soft fish robots using piezoelectric fiber composite 2013 IEEE Int. Conf. on Mechatronics and Automation Ming A, Ichikawa T, Zhao W and Shimojo M 2014 Development of a sea snake-like underwater robot 2014 IEEE Int. Conf. on Robotics and Biomimetics (ROBIO 2014)",Ming_etal_2013,,FALSE
"Neveln I D, Bai Y, Snyder J B, Solberg J R, Curet O M, Lynch K M and MacIver M A 2013 Biomimetic and bio-inspired robotics in electric fish research J. Exp. Biol. 216 2501–14",Neveln_etal_2013,,FALSE
"Ozmen Koca G, Bal C, Korkmaz D, Bingol M, Ay M, Akpolat Z and Yetkin S 2018 Three-dimensional modeling of a robotic fish based on real carp locomotion Appl. Sci. 8 180",Ozmen_etal_2018,,FALSE
"Phamduy P, Vazquez M A, Kim C, Mwaffo V, Rizzo A and Porfiri M 2017 Design and characterization of a miniature freeswimming robotic fish based on multi-material 3D printing",Phamduy_etal_2017,,FALSE
"Pin Y H, Hoe L B, Kin K T T and Saad I 2011 Swimming motion control for biometric fish robot by utilizing turning coefficient 2011 2nd Int. Conf. on Intelligent Systems, Modelling and",Pin_2011,,FALSE
"Ren Q, Xu J, Gao W and Niu X 2012 Generation of robotic fish locomotion through biomimetic learning 2012 IEEE/RSJ Int.Conf. on Intelligent Robots and Systems",Ren_etal_2012,,FALSE
" Su Z, Yu J, Tan M and Zhang J 2011 A closed-loop method to generate fast C-start for a robotic fish 2011 IEEE Int. Conf. on Mechatronics and Automation",Su_etal_2011,,FALSE
"Tomie M, Takiguchi A, Honda T and Yamasaki J 2005 Turning performance of fish-type microrobot driven by external magnetic field IEEE Trans. Magn. 41 4015–7",Tomie_etal_2005,,FALSE
"Tytell E, Holmes P and Cohen A 2011 Spikes alone do not behav- ior make: why neuroscience needs biomechanics Curr. Opin. Neurobiol. 21 816–22",Tytell_2011,,FALSE
"Wang M, Dong H, Li X, Zhang Y and Yu J 2019 Control and optimization of a bionic robotic fish through a combination of CPG model and PSO Neurocomputing 337 144–52",Wang_etal_2019,,FALSE
"Wang M, Yu J and Tan M 2014 CPG-based sensory feedback con- trol for bio-inspiredmultimodal swimming Int. J. Adv. Robot. Syst. 11 170
Wang",Wang_etal_2014,,FALSE
"Wang M, Yu J, Tan M and Zhang G 2011 A CPG-based sensory feedback control method for robotic fish locomotion Proc. of the 30th Chinese Control Conf.",Wang_etal_2011_b,,FALSE
"Wang T, Hu Y and Liang J 2013 Learning to swim: a dynamical systems approach to mimicking fish swimming with CPG Robotica 31 361–9
Webb",Wang_etal_2013,,FALSE
Webb P W and Fairchild A G 2001 Performance and maneuverability of three species of teleostean fishes Can. J. Zool. 79,Webb_2001,,FALSE
"Wu Z, Yu J, Su Z, Tan M and Li Z 2015 Towards an Esox lucius inspired multimodal robotic fish Sci. China Inf. Sci. 58 1–13",Wu_etal_2015,,FALSE
"Xie F, Zhong Y, Du R and Li Z 2019 Central pattern generator (CPG) control of a biomimetic robot fish for multimodal swimming J. Bionic Eng. 16 222–34",Xie_etal_2019,,FALSE
"Yang Y, Wang J, Wu Z and Yu J 2018 Fault-tolerant control of a CPG-governed robotic fish Engineering 4 861–8
Yu",Yang_etal_2018,,FALSE
"Yu J, Chen S, Wu Z, Chen X and Wang M 2018 Energy analysis of a CPG-controlled miniature robotic fish J. Bionic Eng. 15",Yu_etal_2018,,FALSE
"Yu J, Liu L and Wang L 2006 Dynamics and control of turning maneuver for biomimetic robotic fish 2006 IEEE/RSJ Int.",Yu_etal_2006,,FALSE
"Yu J, Liu L, Wang L, Tan M and Xu D 2008 Turning control of a multilink biomimetic robotic fish IEEE Trans. Robot. 24",Yu_etal_2008,,FALSE
"Yuan J, Yu J, Wu Z and Tan M 2015 Enhancing swimming performance of a biomimetic robotic fish by optimizing oscillator phase differences of a CPG model 2015 IEEE Int. Conf. on Robotics and Biomimetics ",Yuan_etal_2015,,
Yu J and Tan M 2020 Implementing flexible and fast turning maneuvers of multijoint robotic fish Motion Control of Biomimetic Swimming Robots (Berlin: Springer) pp 47–69,Yu_2020,,FALSE
"Yu J, Wang L, Shao J and Tan M 2007 Control and coordination of multiple biomimetic robotic fish IEEE Trans. Control Syst.",Yu_etal_2007,,FALSE
"Howe, S., Bryant, K., Duff, A., & Astley, H. (2022). Testing the effects of body depth on fish maneuverability via robophysical models. Bioinspiration and Biomimetics, 17(1). https://doi.org/10.1088/1748-3190/ac33c1",Howe_etal_2022,,TRUE
"Aguilar J et al 2016 A review on locomotion robophysics: the study of movement at the intersection of robotics, soft matter and dynamical systems Rep. Prog. Phys. 79 110001",Aguilar_etal_2016,,FALSE
Astley H C 2016 The diversity and evolution of locomotor muscle properties in anurans J. Exp. Biol. 219 3163–73,Astley_2016,,FALSE
Blake R W 1979 The mechanics of labriform locomotion: I. Labriform locomotion in the angelfish (Pterophyllum eimekei): an analysis of the power stroke J. Exp. Biol. 82 255–71,Blake_1979,,FALSE
"Boulenger G 1895 Abstract of a report on a large collection of fishes formed by Dr. C Ternetz in Matto Grosso and Paraguay, with descriptions of new species Proc. Zool. Soc. Lond. 2 523–9",Boulenger_1895,,FALSE
Brönmark C and Miner J G 1992 Predator-induced phenotypi- cal change in body morphology in crucian carp Science 258 1348–50,Brönmark_1992,,FALSE
Burns M D and Sidlauskas B L 2019 Ancient and contingent body shape diversification in a hyperdiverse continental fish radiation Evolution 73 569–87,Burns_2019,,FALSE
"Claverie T andWainwright P C2014 Amorphospace for reeffishes: elongation is the dominant axis ofbody shape evolution PLoS One 9 e112732
Costa-Pereira",Claverie_2014,,FALSE
"Costa-Pereira R, Ara´ujo M, Paiva F and Tavares L 2016 Func- tional morphology of the tetra fish Astyanax lacustris differs between divergent habitats in the Pantanal wetlands J. Fish Biol. 89 1450–8",Costa-Pereira_2016,,FALSE
"Domenici P, Turesson H, Brodersen J and Brönmark C 2008 Predator-induced morphology enhances escape locomotion in crucian carp Proc. R. Soc. B. 275 195–201",Domenici_etal_2008,,FALSE
"Eigenmann C H and Kennedy C H 1903 On a collection of fishes from Paraguay, with a synopsis of the American genera of cichlids Proc. Acad. Nat. Sci. Phila. 55 497–537",Eigenmann_1903,,FALSE
Feilich K L 2016 Correlated evolution of body and fin morphology in the cichlid fishes Evolution 70 2247–67,Feilich_2016,,FALSE
Felsenstein J 1985 Phylogenies and the comparative method Am. Nat. 125 1–15,Felsenstein_1985,,FALSE
"Fernando A V, Hecke K B and Eggleton M A 2018 Length, body depth, and gape relationships and inference on piscivory among common North American centrarchids Southeast.",Fernando_etal_2018,,FALSE
"M, Pollux B J A and Voesenek C J 2018 Three-dimensional analysis of the fast-start escape response of the least killifish, Heterandria formosa J. Exp. Biol. 221 jeb168609",Pollux_2018,,FALSE
"oster K, Bower L and Piller K 2015 Getting in shape: habitat-based morphological divergence for two sympatric fishes Biol. J. Linn. Soc. 114 152–62",Foster_etal_2015,,FALSE
"Franssen N R, Stewart L K and Schaefer J F 2013 Morphological divergence and flow-induced phenotypic plasticityin a native fish fromanthropogenically altered stream habitats Ecol. Evol. 3 4648–57",Franssen_etal_2013,,FALSE
Garland T Jr and Adolph S C 1994 Why not to do two-species comparative studies: limitations on inferring adaptation Physiol. Zool. 67 797–828,Garland_1994,,FALSE
George A B and Westneat M W 2019 Functional morphology of endurance swimming performance and gait transition strategies in balistoid fishes J. Exp. Biol. 222 jeb194704,George_2019,,FALSE
"Gerry S P, Belden J, Bisaccia M, George K, Mahoney T and Ellerby D J 2016 Scaling of the fast-start escape response of juvenile bluegills Zoology 119 518–25",Gerry_etal_2016,,FALSE
Gerstner C L 1998 The function of a deep body morphology in coral reef fishes: enhanced maneuverability or protection from gape-limited predators? PhD Dissertation University of,Gerstner_1998,,FALSE
Gerstner C L 1999 Maneuverability of four species of coral-reef fish that differ in body and pectoral-fin morphology Can. J. Zool.,Gerstner_1999,,FALSE
"Haas T C, Heins D C and Blum M J 2015 Predictors of body shape among populations of a stream fish (Cyprinella venusta, cypriniformes: cyprinidae) Biol. J. Linn. Soc. 115 842–58",Haas_etal_2015,,FALSE
"Howe S, Bryant K, Duff S and Astley H 2021 Testing the effects of body depth on fish maneuverability via robophysical models Bioinspir. Biomim. https://doi.org/10.5061/dryad.1g1jwstwj",Howe_etal_2021_b,,FALSE
