paper,citationKey,robot,Main
"Liu, J., & Hu, H. (2005). Mimicry of Sharp Turning Behaviours in a Robotic Fish. Proceedings of the 2005 IEEE International Conference on Robotics and Automation Barcelona, Spain, April 2005.",LiuHu_2005,,TRUE
"Shuxiang Guo, Toshio Fukuda, Norihiko Kato, Keisuke Oguro，Devel- opment of Underwater Microbot Using ICPF Actuator，Proceedings of the IEEE International Conference on Robotics and Automation , 1998",Guo_etal_1998,,FALSE
"Igor L. Y. Spierts, Johan L. Van Leeuwen. ""Kinematics and muscle dynamics of C-and S-starts of carp(syprinus carpio L.)"". Journal of Experimental Biology, 202, 1999, pages 393-406.",Spierts_1999,,FALSE
"J.Z. Yu, etc. A simplified Propulsive Model of Biomimetic Robot Fish and Its Realization. IEEE Transactions on Systems, Man and Cybernetics Part B: Cybernetics, Vol. 34, No. 4, 2004, pages 17981810.",Yu_2004,,FALSE
"E.G. Drucker and G.V. Lauder. Wake dynamics and fluid forces of turning maneuvers in sunfish. Journal of Experimental Biology, 204, 2001, pages 431-442. ",DruckerLauder_2001_c,,FALSE
"Liu, J., & Hu, H. (2010). Biological inspiration: from carangiform fish to multi-joint robotic fish. Journal of Bionic Engineering, 7(1), 35–48.",LiuHu_2010,,TRUE
"Nato N. Control performance in the horizontal plane of a fish robot with mechanical pectoral fins. IEEE Journal of Oceanic Engineering, 2000, 25, 121–129.",Nato_2000,,FALSE
"Witting J, Safak K, Adams G. Shape memory alloy actuators applied to biomimetic underwater robots. In: Ayers J, Davis J, Rudolph A (eds). Neurotechnology for Biomimetic Robots, MIT Press, USA, 2001, 117–136.",Witting_etal_2001,,FALSE
"Liang J, Wang T, Wei H, Tao W. Researchful development of underwater robofish II: Development of a small experilating fish models. The Journal of Experimental Biology, mental robofish. Robot, 2002, 24, 234–238. (in Chinese)",Liang_etal_2002,,FALSE
"Hu T, Shen L, Lin L, Xu H. Biological inspirations, kinebiomimetic robot fish and its realization. Robotica, 2005, 23, matics modeling, mechanism design and experiments on an Mechanism and Machine Theory, 2008, 44, 633–645.",Hu_etal_2008,,FALSE
"Zhao W, Yu J, Fang Y, Wang L. Development of multi-mode biomimetic robotic fish based on central pattern generator. Proceedings of International Conference of In- telligent Robots and Systems, Beijing China, 2006, 3891–3896",Zhao_etal_2006,,FALSE
"Nagrath S, Sequist L V, Maheswaran S, Bell D W, Irimia D, Streitlien K, Triantafyllou G S, Triantafyllou M S. Efficient foil propulsion through vortex control. AIAA Journal, 1996, 34, 2315–2319",Nagrath_etal_1996,,FALSE
"Lauder G V, Drucker E G. Morphology and experimental hydrodynamics of fish fin control surfaces. IEEE Journal of Oceanic Engineering, 2004, 29, 556–571",Lauder_2004,,FALSE
"Yu J, Chen E, Wang S, Tan M. Research evolution and analysis of biomimetic robot fish. Journal of Control Theory and Application, 2002, 24, 169–174.",Yu_etal_2002,,FALSE
"Liu J, Dukes L, Knight R, Hu H. Development of fish-like swimming behaviours for an autonomous robotic fish. Proceedings of the Control, University of Bath, UK, 2004, 217",Liu_etal_2004,,FALSE
"Morganse K A, Duindam V, Mason R J, Burdick J W, Murray R M. Nonlinear control methods for planar ca- rangiform robot fish locomotion. Proceeding of IEEE In- ternational Conference on Robotics and Automation, 2001, 1, 427–434",Morganse_etal_2001,,FALSE
"Li, L., Wang, C., Fan, R., & Xie, G. (2016). Exploring the backward swimming ability of a robotic fish. International Journal of Advanced Robotic Systems, 13(5), 1–10. https://doi.org/10.1177/1729881416669483",Li_etal_2016,,TRUE
Low KH. Modelling and parametric study of modular undulating fin rays for fish robots. Mech Mach Theory 2009; 44(3): 615–632.,Low_2009_b,,FALSE
Tan X. Autonomous robotic fish as mobile sensor platforms: Challenges and potential solutions. Mar Technol Soc J 2011; 45(4): 31–40.,Tan_2011,,FALSE
"Zhang FT, Thon J, Thon C, et al. Miniature underwater glider: Design and experimental results. IEEE/ASME Trans Mechatron 2014; 19(1): 394–399.",Zhang_etal_2014,,FALSE
"Du R, Li Z, Youcef-Toumi K, et al. Robot fish: Bio-inspired fishlike underwater robots. Berlin Heidelberg: Springer, 2015.",Du_etal_2015,,FALSE
"Low KH, Zhou C and Zhong Y. Gait planning for steady swimming control of biomimetic fish robots. Adv Robot 2009; 23(7–8): 805–829.",Low_etal_2009,,FALSE
"Yu J, Wang L and Min T. A framework for biomimetic robot fish's design and its realization. In: Proc Amer control conf, Portland, OR, 8–10 June 2005, pp. 1593–1598. Portland, OR: IEEE.",Yu_etal_2005_b,,FALSE
"Hu H, Liu J, Dukes I, et al. Design of swim patterns for autonomous robotic fish. In: Proc IEEE/RSJ int conf intell robots syst, Beijing, China, 9–15 October 2006, pp. 2406–2411. Beijing, China: IEEE.",Hu_etal_2006,,FALSE
"Ding R, Yu J, Yang Q, et al. Dynamic modelling of a cpgcontrolled amphibious biomimetic swimming robot. Int J Adv Rob Sys 2013; 10(199): 1–11.",Ding_etal_2013,,FALSE
Wang W and Xie G. Online high-precision probabilistic localization of robotic fish using visual and inertial cues. IEEE Trans Ind Electron 2014; 62(2): 1113–1124.,Wang_2014,,FALSE
"Anton M, Zheng C, Kruusmaa M, et al. Analytical and computational modeling of robotic fish propelled by soft actuation material-based active joints. In: Proc int conf intell robots syst, St. Louis, USA 11–15 October 2009, pp.",Anton_etal_2009,,FALSE
"Zhou C, Cao Z, Hou Z, et al. Indeterminate backward swimming gaits for a carangiform robotic fish. Neural Comput & Applic 2012; 23(7): 2015–2021.",Zhou_etal_2012,,FALSE
D'Aout K and Aerts P. A kinematic comparison of forward and backward swimming in the eel Anguilla anguilla. J Exp Biol 1999; 202(11): 1511–1521.,DAout_1999,,FALSE
"Islam SS, Zelenin PV, Orlovsky GN, Grillner S, et al. Pattern of motor coordination underlying backward swimming in the lamprey. J Neurophysiol 2006; 96(1): 451–460.",Islam_etal_2006,,FALSE
"Yu JZ, Wu Z, Wang M, et al. CPG network optimization for a biomimetic robotic fish via PSO. IEEE T Neural Networ 2015; 27(9): 1962–1968.",Yu_etal_2015,,FALSE
"Wang C and Xie GM, Wang L, et al. -based locomotion control of a robotic fish: linear oscillators and reducing control parameters via. Int J Innov Comput I 2011; 7(7B): 4237–4249.",Wang_etal_2011,,FALSE
"Li L, Wang C and Xie G. A general network and its implementation on the microcontroller. Neurocomput 2015; 167(2015): 299–305.",Li_etal_2015,,FALSE
"Li L, Wang C, Xie G, et al. Digital implementation of controller in AVR system. In: Proc 33rd Chin control conf, Nanjing, China, 28–30 July 2014, pp. 8293–8298. New York: IEEE.",Li_etal_2014,,FALSE
"Li L, Wang C and Xie G. Modeling of a carangiform-like robotic fish for both forward and backward swimming: Based on the fixed point. In: Proc IEEE int conf robot autom, Hongkong, China, May 31–June 7 2014, pp. 800–805. New York: IEEE.",Li_etal_2014_b,,FALSE
Sparenberg JA. Survey of the mathematical theory of fish locomotion. J Eng Math 2002; 44(4): 395–448.,Sparenberg_2002,,FALSE
"Shao L and Xie G. Real-time tracking of moving objects on a water surface. In: Proc IEEE int conf mech autom, Chengdu, China, 5–8 August 2012, pp. 2114–2119. New York: IEEE.",Shao_2012,,FALSE
"Kennedy J and Eberhart R. Particle swarm optimization. In: Proc IEEE int conf neural netw, volume 4, Perth, WA, Australia, 27 November–1 December 1995, pp. 1942–1948. New York: IEEE.",Kennedy_1995,,FALSE
"Shi Y and Eberhart R. A modified particle swarm optimizer. In: Proc IEEE world congr comput intell, Anchorage, AK, USA, 4–9 May 1998, pp. 69–73. New York: IEEE.",Shi_1998,,FALSE
"Clerc M and Kennedy J. The particle swarm—Explosion, stability, and convergence in a multidimensional complex space. IEEE Trans Evol Comput 2002; 6(1): 58–73.",Clerc_2002,,FALSE
"Low, K. H., & Chong, C. W. (2010). Parametric study of the swimming performance of a fish robot propelled by a flexible caudal fin. Bioinspiration & Biomimetics, 5(4), 46002.",LowChong_2010,,TRUE
"Wernli R L 1999 AUVs—the maturity of the technology MTS/IEEE OCEANS’99 (Seattle, WA) pp 189–95",Wernli_1999,,
"Chong C W, Zhong Y, Zhou C L, Low K H and Seet G 2009 Can the swimming thrust of BCF biomimetics fish be enhanced? Proc. IEEE Int. Conf. on Robotics and Biomimetics (Bangkok, Thailand) pp 437–42",Chong_2009,,FALSE
Lionel L 2006 Underwater robots: part I. Current systems and problem pose Mobile Robotics—Towards New Applications ed A Lazinica (Germany/Austria: Pro Literatur Verlag/ARS) pp 335–60,Lionel_2006,,FALSE
Lauder G V and Tytell E D 2005 Hydrodynamics of undulatory propulsion Fish Physiology (vol 23 Fish,Lauder_2005,,FALSE
"Taguchi G 1986 Introduction to Quality Engineering (White Plains, NY: Asian Productivity Organization, UNIPUB)",Taguchi_1986,,FALSE
"Low K H, Chong C W and Zhou C 2010 Performance study of a fish robot propelled by a flexible caudal fin Proc. 2010",Low_etal_2010,,FALSE
Carver R H and Nash C 2005 Doing Analysis with SPSS (Canada: Thomson-Brooks/Cole,Carver_2005,,FALSE
"Triantafyllou M S, Hover F S, Techet A H and Yue D K P 2005 Review of hydrodynamic scaling laws in aquatic",Triantafyllou_etal_2005,,FALSE
"Zhou C, Chong C W, Zhong Y and Low K H 2009 Robust gait control for steady swimming of a carangiform fish robot",Zhou_etal_2009,,FALSE
"Prempraneerach P, Hover F S and Triantafyllou M S 2003",Prempraneerach_2003,,FALSE
Zhou C and Low K H 2010 Better endurance and load capacity: an improved design of Manta Ray Robot (RoMan-II) J. Bionic Eng. 7 S137–44,Zhou_2010,,FALSE
"Lucas, K. N., Thornycroft, P. J. M. M., Gemmell, B. J., Colin, S. P., Costello, J. H., & Lauder, G. V. (2015). Effects of non-uniform stiffness on the swimming performance of a passively-flexing, fish-like foil model. Bioinspiration & Biomimetics, 10(5), 056019. https://doi.org/10.1088/1748-3190/10/5/056019",Lucas_etal_2015,,TRUE
"Lucas K N, Johnson N, Beaulieu W T, Cathcart E, Tirrell G, Colin S P, Gemmell B J, Dabiri J O and Costello J H 2014",Lucas_etal_2014,,FALSE
Combes S A and Daniel T L 2003 Flexural stiffness in insect wings: II. Spatial distribution and dynamic wing bending,Combes_2003,,FALSE
"Long J, McHenry M and Boetticher N 1994 Undulatory swimming: how traveling waves are produced and modulated in sunfish (Lepomis gibbosus) J. Exp. Biol. 192 129–45 (http://",Long_etal_1994,,FALSE
Jayne B C and Lauder G V 1995 Are muscle fibers within fish myotomes activated synchronously? Patterns of recruitment within deep myomeric musculature during swimming in largemouth bass J. Exp. Biol. 198 805–15 (http://jeb.biologists.,Jayne_1995_b,,FALSE
Jayne B C and Lauder G V 1995 Red muscle motor patterns during steady swimming in largemouth bass: effects of speed and correlations with axial kinematics J. Exp. Biol. 198 1575–87 (http://jeb.biologists.org/content/198/7/1575),Jayne_1995_c,,FALSE
Syme D A and Shadwick R E 2002 Effects of longitudinal body position and swimming speed on mechanical power of deep red muscle from skipjack tuna (Katsuwonus pelamis) J. Exp. Biol. 205 189–200 (http://jeb.biologists.org/content/205/2/,Syme_2002_b,,FALSE
"Donley J M, Sepulveda C A, Konstantinidis P, Gemballa S and Shadwick R E 2004 Convergent evolution in mechanical design of lamnid sharks and tunas Nature 429 61–5",Donley_etal_2004,,FALSE
Tytell E D 2004 The hydrodynamics of eel swimming: II. Effect of swimming speed J. Exp. Biol. 207 3265–79,Tytell_2004_c,,FALSE
"Affleck R J 1950 Some points in the function, development and evolution of the tail in fishes Proc. Zool. Soc. London 120",Affleck_1950,,FALSE
Drucker E G and Lauder G V 2001 Locomotor function of the dorsal fin in teleost fishes: experimental analysis of wake forces in sunfish J. Exp. Biol. 204 2943–58 (http://jeb.biologists.org/,Drucker_2001_b,,FALSE
"Tytell E D, Standen E M and Lauder G V 2008 Escaping flatland: three-dimensional kinematics and hydrodynamics of median fins in fishes J. Exp. Biol. 211 187–95",Tytell_2008_b,,FALSE
"Lauder G V, Lim J, Shelton R, Witt C, Anderson E and Tangorra J L 2011 Robotic models for studying undulatory locomotion in fishes Mar. Technol. Soc. J. 45 41–55",Lauder_etal_2011,,FALSE
Borazjani I and Daghooghi M 2013 The fish tail motion forms an attached leading edge vortex Proc. Biol. Sci. 280 20122071,Borazjani_2013_b,,FALSE
"Long J H, Koob-Emunds M, Sinwell B and Koob T J 2002 The notochord of hagfish Myxine glutinosa: visco-elastic properties and mechanical functions during steady swimming J. Exp. Biol. 205 3819–31 (http://jeb.biologists.org/content/205/24/",Long_etal_2002,,FALSE
"Quinn D B, Lauder G V and Smits A J 2014 Flexible propulsors in ground effect Bioinspir. Biomimetics 9 036008",Quinn_etal_2014_b,,FALSE
"Quinn D B, Lauder G V and Smits A J 2015 Maximizing the efficiency of a flexible propulsor using experimental optimization J. Fluid Mech. 767 430–48",Quinn_etal_2015,,FALSE
"Lauder G V, Madden P G A, Tangorra J L, Anderson E and Baker T V 2011 Bioinspiration from fish for smart material design and function Smart Mater. Struct. 20 094014",Lauder_etal_2011_b,,FALSE
"Riggs P, Bowyer A and Vincent J 2010 Advantages of a biomimetic stiffness profile in pitching flexible fin  J. Bionic Eng. 7 113–9",Riggs_etal_2010,,FALSE
"Cleaver D J, Gursul I, Calderon D E and Wang Z 2014 Thrust enhancement due to flexible trailing-edge of plunging foils J. Fluids Struct. 51 401–12",Cleaver_etal_2014,,FALSE
"Read D A, Hover F S and Triantafyllou M S 2003 Forces on oscillating foils for propulsion and maneuvering J. Fluids Struct. 17 163–83",Cleaver_2003,,FALSE
"LauderGV, Anderson E J, Tangorra J and MaddenPGA2007 Fish biorobotics: kinematics and hydrodynamics ofself- propulsion J. Exp. Biol. 210 2767–80",Lauder_2007,,FALSE
"Wen L, Weaver J C and Lauder G V 2014 Biomimetic shark skin: design, fabrication and hydrodynamic function J. Exp.",Wen_etal_2014,,FALSE
Kancharala A K and Philen M K 2014 Study of flexible fin and compliant joint stiffness on propulsive performance: theory and experiments Bioinspir.,Kancharala_2014,,FALSE
Quinn G P and Keough M J 2002 Experimental Design and Data Analysis for Biologists (Cambridge: Cambridge University,Quinn_2002,,FALSE
"Wobbrock J O, Findlater L, Gergle D and Higgins J J 2011 The aligned rank transform for nonparametric factorial analyses using only ANOVA procedures Proc. of the ACM Conf. Human Factors Computing Systems (Vancouver, British Columbia, 7–12 May 2011) (New York: ACM) pp 143–6",Wobbrock_etal_2011,,FALSE
Benjamini Y and Hochberg V 1995 Controlling the false discovery rate: a practical and powerful approach to multiple testing J. R. Statist Soc. 57 289–300,Benjamini_1995,,FALSE
Pérez F and Granger B E 2007 IPython: a system for interactive scientific computing Comput. Sci. Eng. 9 21–9,Pérez_2007,,FALSE
"Winter D 2009 Biomechanics and Motor Control of Human Movement (Hoboken, NJ: Wiley)",Winter_2009,,FALSE
"Colin S P, Costello J H, Dabiri J O, Villanueva A, Blottman J B, Gemmell B J and Priya S 2012 Biomimetic and live medusae reveal the mechanistic advantages of a flexible bell margin PLoS ",Colin_etal_2012,,FALSE
"Manfredi, L., Assaf, T., Mintchev, S., Marrazza, S., Capantini, L., Orofino, S., Ascari, L., Grillner, S., Wallén, P., Ekeberg, Ö., Stefanini, C., & Dario, P. (2013). A bioinspired autonomous swimming robot as a tool for studying goal-directed locomotion. Biological Cybernetics, 107(5), 513–527. https://doi.org/10.1007/s00422-013-0566-2",Manfredi_etal_2013,,TRUE
"Albu-Schaffer A, Ott C, Hirzinger G (2007) A unified passivity based control framework for position, torque and impedance control of flexible joint robots. Int J Rob Res 26(1):23–39",Albu-Schaffer_etal_2007,,FALSE
"Arkin RC (1998) Social behaviour. In: Behaviour-based robotics. MIT Press, Cambridge, Massachusetts",Arkin_1998,,FALSE
"Ascari L, Bertocchi U, Corradi P, Laschi C (2009) Bio-inspired grasp control in a robotic hand with massive sensorial input. Biol Cybern 100(2):109–128",Ascari_etal_2009,,FALSE
"Ayers J, Wilbur C, Olcott C (2000) Lamprey robots. In: Wu, T, Kato, N (ed) In: Proceedings of the international symposium on aqua biomechanisms. Tokai University",Ayers_etal_2000,,FALSE
Bar-Cohen Y (2012) Nature as a model for mimicking and inspiration of new technologies. Int J Aeronaut Space Sci 13(1):1–13,Bar-Cohen_2012,,FALSE
"Barranco F, Diaz J, Ros E, Del Pino B (2009) Visual system based on artificial retina for motion detection. Trans Cybern IEEE 39(3):752–",Barranco_etal_2009,,FALSE
"Beer RD, Quinn RD, Chiel HJ, Ritzmann RE (1997) Biologically inspired approaches to robotics. Commun ACM 40(3):31–38",Beer_etal_1997,,FALSE
"Bradski G, Kaehler A (2008) Learning openCV computer vision with the openCV library. O'Reilly Media, USA",Bradski_2008,,FALSE
"ChielH, Ting L, Ekeberg Ö, HartmannM(2009) The brain in its body— motor control and sensing in a biomechanical context. J Neurosci 29:12807–12814",Chiel_etal_2009,,FALSE
"Crespi A, Ijspeert AJ (2009) Salamandra robotica: a biologically inspired amphibious robot that swims and walks.In: Springer (ED)",Crespi_2009,,FALSE
"Durr V, Schmitz J, Cruse H (2004) Behaviour-based modelling of hexapod locomotion: linking biology and technical application. Arthropod Struct Dev 33(3):237–250",Durr_etal_2004,,FALSE
Ekeberg Ö (1993) A combined neuronal and mechanical model of fish swimming. Biol Cybern 69:363–374,Ekeberg_1993,,FALSE
"Ekeberg Ö, Grillner S (1999) Simulations of neuromuscular control in lamprey swimming. Philos Trans R Soc Lond B 354:895–902",Ekeberg_1999,,FALSE
Grillner S (2003) The motor infrastructure: from ion channels to neuronal networks. Nat Rev Neurosci 4:573–586,Grillner_2003,,FALSE
"Grillner S, Graybiel AM (2006) Microcircuits—the interface between neurons and global brain function. Massachusetts MIT Press, Cambridge Grillner S, Jessell TM (2009) Measured motion: searching for simplicity in spinal locomotor networks. Curr Opin Neurobiol 19:572–586",Grillner_2006,,FALSE
"Grillner S, Kozlov A, Dario P, Stefanini C, Menciassi A, Lansner A, Kotaleski JH (2007) Modeling a vertebrate motor system: pattern generation, steering and control of body orientation. In: Cisek P, Drew T, Kalaska JF (eds) Progress in brain research, vol 165.",Grillner_etal_2007,,FALSE
"Hardisty MW (1986) Petromyzontiforma. In: Holcik J (ed) The fresh- water fishes of Europe. Aula-Verlag, Wiesbaden",Hardisty_1986,,FALSE
"Hardisty MW, Potter IC (1971) The biology of lampreys. Academic Press, London",Hardisty_1971,,FALSE
Hochhalter D (2011) Artificially produced spider silk fibers as a high tech biological material. Basic Biotechnol 7:12–16,Hochhalter_2011,,FALSE
"Hu Y, Katragadda RB, Hongen T, Zheng Q, Li Y, Xu Y (2010) Bioinspired 3-D tactile sensor for minimally invasive surgery. J Microelectromech Syst 19(6):1400–1408",Hu_etal_2010,,FALSE
"Hunter I, Lafontaine S (1992) A comparison of muscle with artificial actuators. In: Workshop solid state sensors actuators, 5th technical digest IEEE 22–25 June 1992, pp 178–185",Hunter_1992,,FALSE
"Islam SS, Zelenin PV, Orlovsky GN, Grillner S, Deliagina TG (2006) Pattern ofmotor coordination underlying backward swimming in the lamprey. J Neurophysiol 96:451–460",Islam_etal_20061,,FALSE
"KawatoM(2000) Robotics as a tool for neuroscience: cerebellar internal models for robotics and cognition. In: Hollerbach MH, Koditschek DE (eds) Robotics research. The ninth international symposium. Springer, London, pp 321–328",Kawato_2000,,FALSE
"Laine A, Kamula R, Hooli J (1998) Fish and lamprey passage in a combined Denil and vertical slot fishway. Fish Manag Ecol 5(4):31–44",Laine_etal_1998,,FALSE
"Li F, Liu W, Fu X, Bonsignori G, Scarfogliero U, Stefanini C, Dario P, (2012) Jumping like an insect: design and dynamic optimization of a jumping mini robot based on bio-mimetic inspiration. Mechatronics 22(2):167–176. ISSN 0957-4158",Li_etal_2012,,FALSE
"Madden JDW, Vandesteeg NA, Anquetil PA, Madden PGA, Takshi A, Pytel RZ, Lafontaine SR, Wieringa PA, Hunter IW (2004) Artificial muscle technology: physical principles and naval prospects. Ocean Eng IEEE J 29(3):706–728",Madden_etal_2004,,FALSE
"Manfredi L, Maini ES, Dario P, Laschi C, Girard B, Tabareau N, Berthoz A (2006) Implementation of a neurophysiological model of saccadic eye movements on an anthropomorphic robotic head. Humanoid Robots, 6th IEEE-RAS international conference on, pp 438–443",Manfredi_etal_2006,,FALSE
"Manfredi L, Maini E S, Laschi C (2009) Neurophysiological models humanoid robotics of gaze control in humanoid robotics. In: Choi B (ed) Humanoid robots, pp 187–212",Manfredi_etal_2009,,FALSE
"Mazzolai B, Mondini A, Corradi P, Laschi C, Mattoli V, Sinibaldi E, Dario P (2011) A miniaturized mechatronic system inspired by plant roots for soil exploration. Trans Mechatron IEEE/ASME 16(2):201–212",Mazzolai_etal_2011,,FALSE
"Ott C, Albu-Schaffer A, Kugi A, Hirzinger G (2008) On the passivity based impedance control of flexible joint robots. IEEE Trans Rob Autom 24(2):416–429",Ott_etal_2008,,FALSE
"Pfeifer R, Iida F, Bongard J (2005) New robotics design principles for intelligent systems artificial life, vol 11. MIT Press, Cambridge MA",Pfeifer_etal_2005,,FALSE
"Pratt G, Williamson M (1995) Series elastic actuators. In: Proceedings IEEE/RSJ international conference on human robot interaction and cooperative robots, vol 1, pp 399–406",Pratt_1995,,FALSE
Rovainen CM (1979) Neurobiology of lampreys. Physiol Rev 59:1007–,Rovainen_1979,,FALSE
"Saitoh K, Menard A, Grillner S (2007) Tectal control of locomotion, steering, and eye movements in lamprey. J Neurophysiol 97(4):3093–3018",Saitoh_etal_2007,,FALSE
"Scarfogliero U, Stefanini C, Dario P (2009) The use of compliant joints and elastic energy storage in bio-inspired legged robots. Mechan Mach Theory 44(3):580–590",Scarfogliero_etal_2009,,FALSE
Webb B (2000) What does robotics offer animal behaviour? Animal Behav 60:545–558,Webb_2000,,FALSE
"Webb B, Consi T (2001) Biorobotics: methods and applications.",Webb_2001_b,,FALSE
Webb B (2001) Can robots make good models of biological behaviour?,Webb_2001_c,,FALSE
Webb B (2008) Using robots to understand animal behaviour. Adv Study Behav 38:1–58,Webb_2008,,FALSE
"Marchese, A. D., Onal, C. D., & Rus, D. (2014). Autonomous Soft Robotic Fish Capable of Escape. Soft Rob, 1(1), 75–87. https://doi.org/10.1089/soro.2013.0009",Marchese_etal_2014,,TRUE
"Borazjani I, Sotiropoulos F, Tytell ED, Lauder GV. Hydrodynamics of the bluegill sunfish C-start escape response: three-dimensional simulations and comparison with experimental data. J Exp Biol 2012;215:671–684.",Borazjani_etal_2012,,FALSE
"Wakeling JM, Johnston IA. Body bending during fast-starts in fish can be explained in terms of muscle torque and hydrodynamic resistance. J Exp Biol 1999;202:675–682.",Wakeling_1999,,FALSE
"Walker JA, Ghalambor CK, Griset OL, McKenney D, Reznick DN. Do faster starts increase the probability of evading predators? Funct Ecol 2005;19:808–815.",Walker_etal_2005,,FALSE
"Gibb AC, Swanson BO, Wesp HM, Landels C, Liu C. Development of the escape response in teleost fishes: do ontogenetic changes enable improved performance? Phsiol Biochem Zool 2006;79:7–19.",Gibb_etal_2006,,FALSE
Bergstrom CA. Fast-start swimming performance and reduction in lateral plate number in threespine stickleback. Can J Zool 2002;80:207–213.,Bergstrom_2002,,FALSE
"Shepherd RF, Ilievski F, Choi W, Morin SA, Stokes AA, Mazzeo AD, Chen X, Wang M, Whitesides GM. Multigait soft robot. Proc Natl Acad Sci USA 2011;108:20400–20403.",Shepherd_etal_2011,,FALSE
"Shepherd RF, Stokes AA, Freake J, Barber J, Snyder PW, Mazzeo AD, Cademartiri L, Morin SA, Whitesides GM. Using explosions to power a soft robot. Angew Chem 2013;125:2964–2968.",Shepherd_etal_2013,,FALSE
"Xu JX, Ren Q, Gao W, Niu XL. Mimicry of fish swimming patterns in a robotic fish. 2012 IEEE International Symposium on Industrial Electronics (ISIE), 2012.",Xu_etal_2012,,FALSE
Otis AB. The work of breathing. Physiol Rev 1954;34: 449–458.,Otis_1954,,FALSE
Haaland SE. Simple and explicit formulas for the friction factor in turbulent. J Fluids Eng 1983;105:8990.,Haaland_1983,,FALSE
"Eaton RC, Lee RKK, Foreman MB. The Mauthner cell and other identified neurons of the brainstem escape network of fish. Prog Neurobiol 2001;63:467–485.",Eaton_etal_2001,,FALSE
"Wöhl S, Schuster S. The predictive start of hunting archer fish: a flexible and precise motor pattern performed with the kinematics of an escape C-start. J Exp Biol 2007;210:311–324.",Woehl_2007,,FALSE
"Tytell ED, Lauder GV. The C-start escape response of Polypterus senegalus: bilateral muscle activity and variation during stage 1 and 2. J Exp Biol 2002;205:2591– ",Tytell_2002,,FALSE
"Mason, R., & Burdick, J. W. (2000). Experiments in carangiform robotic fish locomotion. Proceedings of the 2000 IEEE International Conference on Robotics & Automation, 1, 428–435.",MasonBurdick_2000,,TRUE
"J. N. Newman and T. Y. Wu. Hydrodynamicalaspects of fish swimming. In T. Wu, C. Brokaw, and C. Brennen, editors, Swimming and Flying in Nature, Vol 2., pages 615-634. Plenum Press, New York, 1975.",Newman_1975,,FALSE
"K. A. Harper, M. D. Berkemeier, and S. Grace. Modeling the dynamics of spring-driven oscillatingfoil propulsion. IEEEJ Oceanic Eng., 23:(3):285-296, 1998.",Harper_etal_1998,,FALSE
"B. Ahlborn, S. Chapman, R. Stafford, R. W. Blake, and D. G. Harper. Experimental simulation of the thrust phases of fast-start swimming of fish. J Exper Biol., 200:2301-2312, 1997.",Ahlborn_etal_2301,,FALSE
"D. Weihs. A hydrodynamical analysis of fish turning Future Work manoeuvres. Proc. R. Soc. Lond., B. 182:59-72, 1972.",Weihs_1972,,FALSE
"R. Mason and J. Burdick. Propulsion and control of deformable bodies in an ideal fluid. In IEEE International Conference on Robotics and Automation, Detroit, 1999.",Mason_1999,,FALSE
